<!DOCTYPE bookstore [
<!ELEMENT bookstore (book+)>
<!ELEMENT book (title, author, year)> <!ELEMENT title (#PCDATA)>
<!ELEMENT author (#PCDATA)>
<!ELEMENT year (#PCDATA)>
<!ATTLIST book id ID #REQUIRED>
]>